{
  "$schema": "http://json-schema.org/draft-07/schema#",
  "$id": "https://skyblip.eu/schemas/scenario.v1.schema.json",
  "title": "skyBlip simulator scenario (v1)",
  "description": "One scenario drives the browser simulator, the terminal simulator and the host regression suite. Parsed and replayed by firmware/simulator/world.",
  "type": "object",
  "properties": {
    "name": {"type": "string"},
    "mode": {"enum": ["device", "demo", "training"]},
    "callsign": {"type": "string", "description": "The name the simulated device transmits, S-BLIP when absent"},
    "latitude_1e7": {"type": "integer"},
    "longitude_1e7": {"type": "integer"},
    "altitude_m": {"type": "integer"},
    "speed_kt": {"type": "integer", "minimum": 0},
    "track_deg": {"type": "integer", "minimum": 0, "maximum": 359},
    "turn_dps": {"type": "integer", "minimum": -50, "maximum": 50, "description": "Own-ship turn rate, degrees per second, positive to the right. A thermalling glider holds 13 to 18."},
    "duration_ms": {"type": "integer", "minimum": 0},
    "aircraft": {
      "type": "array",
      "items": {
        "type": "object",
        "properties": {
          "system": {"type": "string", "enum": ["adsl_direct", "alptas", "adsl_uplink"], "description": "What reaches us from this aircraft: its own ADS-L or FLARM-generation burst on the M band, or a skyPost ground station's O-band relay of it, which is what 'adsl_uplink' means. An 'adsl_uplink' aircraft never transmits itself. The system is the only thing that decides whether our shared sync window frames this aircraft's bursts."},
          "north_m": {"type": "integer"},
          "east_m": {"type": "integer"},
          "up_m": {"type": "integer"},
          "speed_mps": {"type": "integer", "minimum": 0},
          "track_deg": {"type": "integer", "minimum": 0, "maximum": 359},
          "turn_dps": {"type": "integer", "minimum": -50, "maximum": 50, "description": "Turn rate of this aircraft, degrees per second, positive to the right."},
          "climb_mps_e1": {"type": "integer", "minimum": -300, "maximum": 300, "description": "Vertical rate of this aircraft, tenths of a metre per second, positive up. It is broadcast as the aircraft's climb rate and its height moves at it, so a 30 (3 m/s, 590 fpm) thermalling glider wears a climb chevron on the radar tag and its altitude tag counts up."},
          "phase_ms": {"type": "integer", "minimum": -1, "maximum": 999},
          "slot": {"type": "integer", "minimum": -1, "maximum": 1}
        },
        "additionalProperties": false
      }
    },
    "events": {
      "type": "array",
      "items": {
        "type": "object",
        "properties": {
          "at_ms": {"type": "integer", "minimum": 0},
          "fix": {"type": "integer", "enum": [0, 1]},
          "pps": {"type": "integer", "enum": [0, 1]},
          "barometer": {"type": "integer", "enum": [0, 1]},
          "battery_mv": {"type": "integer", "minimum": 0, "maximum": 5000},
          "external_power": {"type": "integer", "enum": [0, 1]},
          "button": {"type": "integer"},
          "altitude_m": {"type": "integer"},
          "speed_kt": {"type": "integer", "minimum": 0},
          "track_deg": {"type": "integer"},
          "aircraft": {"type": "integer"},
          "expect_alarm_minimum": {"type": "integer", "minimum": 0, "maximum": 3},
          "expect_traffic_minimum": {"type": "integer", "minimum": 0}
        },
        "required": ["at_ms"],
        "additionalProperties": false
      }
    }
  },
  "additionalProperties": false
}
