{
  "name": "ADS-L and ALP-TAS neighbours in one dwell",
  "mode": "training",
  "latitude_1e7": 485000000,
  "longitude_1e7": 85000000,
  "altitude_m": 1000,
  "speed_kt": 55,
  "track_deg": 0,
  "duration_ms": 12000,
  "aircraft": [
    {"system": "adsl_direct", "north_m": 1500, "east_m": -300, "up_m": 20, "speed_mps": 35, "track_deg": 180, "slot": 0},
    {"system": "alptas", "north_m": 900, "east_m": 250, "up_m": -40, "speed_mps": 30, "track_deg": 190, "slot": 1, "climb_mps_e1": -25}
  ],
  "events": [
    {"at_ms": 4000, "expect_traffic_minimum": 2},
    {"at_ms": 9000, "expect_alarm_minimum": 1}
  ]
}
