{
  "name": "two gliders circling one thermal, offset cores",
  "mode": "training",
  "latitude_1e7": 485000000,
  "longitude_1e7": 85000000,
  "altitude_m": 1500,
  "speed_kt": 45,
  "track_deg": 0,
  "turn_dps": 13,
  "duration_ms": 32000,
  "aircraft": [
    {"north_m": 128, "east_m": 42, "up_m": 0, "speed_mps": 23, "track_deg": 34, "turn_dps": 13}
  ],
  "events": [
    {"at_ms": 6000, "expect_traffic_minimum": 1}
  ]
}
