{
  "name": "slot timing: one neighbour per dwell, one outside them all",
  "mode": "device",
  "latitude_1e7": 485000000,
  "longitude_1e7": 85000000,
  "altitude_m": 1000,
  "speed_kt": 45,
  "track_deg": 90,
  "duration_ms": 8000,
  "aircraft": [
    {"north_m": 900, "east_m": 0, "up_m": 0, "speed_mps": 30, "track_deg": 180, "phase_ms": 600, "slot": 0},
    {"north_m": -900, "east_m": 300, "up_m": 50, "speed_mps": 30, "track_deg": 0, "phase_ms": 900, "slot": 1},
    {"north_m": 0, "east_m": 1200, "up_m": -50, "speed_mps": 30, "track_deg": 270, "phase_ms": 300, "slot": 0}
  ],
  "events": [
    {"at_ms": 4000, "expect_traffic_minimum": 2}
  ]
}
